{
    "name": "RPLC_M",
    "memory": 512,
    "hal": {
        "serial": true,
        "speaker": true,
        "can": true,
        "usb": true
    },
    "services": {
        "notification": true,
        "usb_serial_bridge": true,
        "can_open": true
    },
    "tests": {
        "memmng": true
    },
    "compileDefinition": "RPLC_M"
}
