{
    "name": "RPLC_L",
    "memory": 1024,
    "hal": {
        "flash_ex": true,
        "io": true,
        "rtc": true,
        "serial": true,
        "speaker": true,
        "can": true,
        "random": true
    },
    "services": {
        "notification": true,
        "can_open": true
    },
    "tests": {
        "memmng": true,
        "flash_ex": true
    },
    "compileDefinition": "RPLC_L"
}
